{
  "$schema": "../schema.json",
  "vulnerability_id": "CVE-2024-39722",
  "title": "Ollama api/push path traversal file existence disclosure",
  "description": "Ollama before 0.1.46 exposes which files exist on the server through a path traversal in the api/push route. An attacker can probe filesystem paths and infer the presence of sensitive files (configs, keys, application binaries), aiding reconnaissance and follow-on exploitation against the inference host.",
  "affected_component": "inference_server",
  "affected_products": ["Ollama < 0.1.46"],
  "dsgai_mapping": ["DSGAI01", "DSGAI17"],
  "owasp_llm_top10_mapping": ["LLM02:2025", "LLM02:2026"],
  "severity": {
    "qualitative": "High",
    "cvss_v3_score": 7.5,
    "cvss_v3_vector": "CVSS:3.1/AV:N/AC:L/PR:N/UI:N/S:U/C:H/I:N/A:N"
  },
  "cve_id": "CVE-2024-39722",
  "cwe_ids": ["CWE-22"],
  "source_urls": [
    "https://nvd.nist.gov/vuln/detail/CVE-2024-39722",
    "https://www.oligo.security/blog/more-models-more-probllms"
  ],
  "date_reported": "2024-10-31",
  "date_added": "2026-05-18",
  "disclosure_status": "public_cve",
  "exploit_available": "public_poc",
  "mitigations": [
    "Upgrade Ollama to 0.1.46 or later.",
    "Place Ollama behind an authenticated reverse proxy; do not expose api/* routes publicly.",
    "Run Ollama as a low-privilege user with a minimal filesystem view."
  ],
  "tags": ["path-traversal", "information-disclosure", "inference-server"]
}
