{
  "$schema": "../schema.json",
  "vulnerability_id": "CVE-2024-0243",
  "title": "LangChain RecursiveUrlLoader prevent_outside bypass",
  "description": "LangChain before 0.1.0 fails to honor the prevent_outside=True security parameter in RecursiveUrlLoader. An attacker who controls a website referenced by the loader can embed links to external domains, causing the crawler to fetch unintended URLs despite the restriction. The flaw is an incomplete fix that follows CVE-2023-46229 and is also classified as SSRF.",
  "affected_component": "rag_pipeline",
  "affected_products": ["LangChain < 0.1.0"],
  "dsgai_mapping": ["DSGAI06", "DSGAI13"],
  "owasp_llm_top10_mapping": ["LLM05:2025", "LLM10:2026"],
  "severity": {
    "qualitative": "High",
    "cvss_v3_score": 8.1,
    "cvss_v3_vector": "CVSS:3.1/AV:N/AC:H/PR:N/UI:N/S:U/C:H/I:H/A:H"
  },
  "cve_id": "CVE-2024-0243",
  "cwe_ids": ["CWE-918"],
  "source_urls": [
    "https://nvd.nist.gov/vuln/detail/CVE-2024-0243",
    "https://huntr.com/bounties/370904e7-10ac-40a4-a8d4-e2d16e1ca861",
    "https://github.com/langchain-ai/langchain/pull/15559"
  ],
  "date_reported": "2024-02-26",
  "date_added": "2026-05-18",
  "disclosure_status": "public_cve",
  "exploit_available": "public_poc",
  "mitigations": [
    "Upgrade to LangChain 0.1.0 or later.",
    "Enforce egress allowlisting at the network layer; do not rely on loader-level domain checks alone."
  ],
  "tags": ["ssrf", "rag-ingestion", "control-bypass"]
}
