{
  "$schema": "../schema.json",
  "vulnerability_id": "CVE-2025-0845",
  "title": "ChatGPT persistent-memory poisoning via URL-fetched indirect prompt injection",
  "description": "Johann Rehberger disclosed that ChatGPT's persistent-memory feature could be poisoned via indirect prompt injection. An attacker hosts a web page containing hidden instructions; the victim asks ChatGPT to summarize or browse the URL; the server-side browser fetches the page and processes the embedded directives, causing ChatGPT to write attacker-controlled facts into the user's long-term memory store. Because the injected memory persists across sessions, the attacker can establish a covert exfiltration channel that survives across new conversations.",
  "affected_component": "agent_framework",
  "affected_products": ["OpenAI ChatGPT (memory feature, pre-fix configuration)"],
  "dsgai_mapping": ["DSGAI01", "DSGAI11", "DSGAI15"],
  "owasp_llm_top10_mapping": ["LLM01:2025", "LLM02:2025", "LLM01:2026", "LLM02:2026"],
  "severity": {
    "qualitative": "Medium",
    "cvss_v3_score": 6.4,
    "cvss_v3_vector": "CVSS:3.1/AV:N/AC:L/PR:L/UI:N/S:C/C:L/I:L/A:N"
  },
  "cve_id": "CVE-2025-0845",
  "cwe_ids": ["CWE-77"],
  "source_urls": [
    "https://embracethered.com/blog/posts/2024/chatgpt-hacking-memories/",
    "https://www.darkreading.com/endpoint-security/chatgpt-memory-feature-prompt-injection",
    "https://thehackernews.com/2024/09/chatgpt-macos-flaw-couldve-enabled-long.html"
  ],
  "date_reported": "2024-09-24",
  "date_added": "2026-05-18",
  "disclosure_status": "coordinated_disclosure",
  "exploit_available": "public_poc",
  "mitigations": [
    "Require an explicit user confirmation step before any persistent-memory write triggered by browsed or retrieved content.",
    "Strip instruction-like phrasing from fetched web content before passing to the model's reasoning surface.",
    "Audit and rate-limit memory writes; expose memory contents to the user for periodic review.",
    "Treat long-term assistant memory as part of the data plane — apply DLP and integrity controls accordingly."
  ],
  "tags": ["prompt-injection", "indirect-prompt-injection", "memory-poisoning", "persistence", "exfiltration"]
}
