{
  "$schema": "../schema.json",
  "vulnerability_id": "CVE-2024-8181",
  "title": "Flowise unauthenticated administrative API access",
  "description": "Flowise 1.8.2 contains a second authentication bypass that allows a remote unauthenticated attacker to reach administrative API endpoints and exercise restricted functionality. Successful exploitation exposes stored credentials, chatflow definitions, and downstream LLM/tool integrations, providing a pivot to the data plane the deployment connects.",
  "affected_component": "agent_framework",
  "affected_products": ["FlowiseAI Flowise 1.8.2"],
  "dsgai_mapping": ["DSGAI02", "DSGAI06"],
  "owasp_llm_top10_mapping": ["LLM05:2025", "LLM10:2026"],
  "severity": {
    "qualitative": "High",
    "cvss_v3_score": 8.1,
    "cvss_v3_vector": "CVSS:3.1/AV:N/AC:L/PR:N/UI:R/S:U/C:H/I:H/A:N"
  },
  "cve_id": "CVE-2024-8181",
  "cwe_ids": ["CWE-287"],
  "source_urls": [
    "https://nvd.nist.gov/vuln/detail/CVE-2024-8181",
    "https://www.tenable.com/security/research/tra-2024-33"
  ],
  "date_reported": "2024-08-27",
  "date_added": "2026-05-18",
  "disclosure_status": "public_cve",
  "exploit_available": "public_poc",
  "mitigations": [
    "Upgrade past Flowise 1.8.2 to the fixed release.",
    "Restrict network access to Flowise admin endpoints; require SSO at the proxy layer.",
    "Rotate provider API keys and re-issue stored credentials after upgrade."
  ],
  "tags": ["authentication-bypass", "low-code-llm", "credential-exposure"]
}
