{
  "$schema": "../schema.json",
  "vulnerability_id": "CVE-2024-9053",
  "title": "vLLM AsyncEngineRPCServer cloudpickle deserialization RCE",
  "description": "vLLM 0.6.0 calls cloudpickle.loads() on messages received by AsyncEngineRPCServer's RPC server entrypoints with no sanitization. An attacker who can reach the RPC endpoint can send a crafted pickle payload that executes arbitrary code on the inference host, taking control of GPU resources and any data the inference process can access (prompts, system prompts, retrieved context).",
  "affected_component": "inference_server",
  "affected_products": ["vLLM 0.6.0"],
  "dsgai_mapping": ["DSGAI06", "DSGAI17"],
  "owasp_llm_top10_mapping": ["LLM03:2025", "LLM05:2025", "LLM04:2026", "LLM10:2026"],
  "severity": {
    "qualitative": "Critical",
    "cvss_v3_score": 9.8,
    "cvss_v3_vector": "CVSS:3.1/AV:N/AC:L/PR:N/UI:N/S:U/C:H/I:H/A:H"
  },
  "cve_id": "CVE-2024-9053",
  "cwe_ids": ["CWE-502", "CWE-78"],
  "source_urls": [
    "https://nvd.nist.gov/vuln/detail/CVE-2024-9053",
    "https://huntr.com/bounties/75a544f3-34a3-4da0-b5a3-1495cb031e09",
    "https://advisories.gitlab.com/pkg/pypi/vllm/CVE-2024-9053/"
  ],
  "date_reported": "2025-03-20",
  "date_added": "2026-05-18",
  "disclosure_status": "public_cve",
  "exploit_available": "public_poc",
  "mitigations": [
    "Upgrade vLLM past 0.6.0; switch to V1 engine where the unsafe path is removed.",
    "Never expose vLLM RPC endpoints outside a trusted, mutually-authenticated network.",
    "Run vLLM in a hardened container with minimal egress; treat pickle-receiving sockets as RCE primitives until fixed."
  ],
  "tags": ["deserialization", "rce", "inference-server", "pickle", "shadowmq"]
}
