{
  "$schema": "../schema.json",
  "vulnerability_id": "CVE-2024-5751",
  "title": "LiteLLM add_deployment environment-variable decryption RCE",
  "description": "BerriAI/LiteLLM 1.35.8 exposes a remote code execution path via the add_deployment function. When /config/update is hit and the get_secret routine fires, the function base64-decodes and decrypts attacker-controlled environment-variable material into os.environ, allowing a crafted payload to trigger execution on the proxy host. Exploitation requires the deployment to use Google KMS and a connected database.",
  "affected_component": "agent_framework",
  "affected_products": ["LiteLLM 1.35.8"],
  "dsgai_mapping": ["DSGAI02", "DSGAI06"],
  "owasp_llm_top10_mapping": ["LLM03:2025", "LLM05:2025", "LLM04:2026", "LLM10:2026"],
  "severity": {
    "qualitative": "Critical",
    "cvss_v3_score": 9.8,
    "cvss_v3_vector": "CVSS:3.1/AV:N/AC:L/PR:N/UI:N/S:U/C:H/I:H/A:H"
  },
  "cve_id": "CVE-2024-5751",
  "cwe_ids": ["CWE-94"],
  "source_urls": [
    "https://nvd.nist.gov/vuln/detail/CVE-2024-5751",
    "https://huntr.com/bounties/ae623c2f-b64b-4245-9ed4-f13a0a5824ce"
  ],
  "date_reported": "2024-06-27",
  "date_added": "2026-05-18",
  "disclosure_status": "public_cve",
  "exploit_available": "public_poc",
  "mitigations": [
    "Upgrade LiteLLM past 1.35.8.",
    "Lock down /config/update to authenticated administrators only; isolate the proxy from untrusted callers.",
    "Audit and rotate KMS-stored secrets after upgrade."
  ],
  "tags": ["rce", "config-injection", "ai-gateway", "secret-decryption"]
}
