{
  "$schema": "../schema.json",
  "vulnerability_id": "DSGAI-VULN-2025-gitlab-duo-prompt-injection",
  "title": "GitLab Duo indirect prompt injection enabling source-code theft via merge-request content",
  "description": "Legit Security disclosed that GitLab Duo, GitLab's AI assistant, ingests the entire context of a page — merge-request descriptions, commit messages, issue comments, and source code — when generating responses. Attackers can hide injection payloads in any of these surfaces using Base16/Base64 encoding, Unicode tag-character smuggling, or KaTeX rendered in white text. A poisoned MR coerces Duo to extract content from a private project and encode it into an attacker-controlled image URL; when the browser renders the response, the HTTP request leaks the encoded code to the attacker's host. GitLab confirmed and patched both the prompt-injection and HTML-injection vectors after disclosure on 2025-02-12.",
  "affected_component": "ide_assistant",
  "affected_products": ["GitLab Duo (pre-patch configuration as of 2025-02-12)"],
  "dsgai_mapping": ["DSGAI01", "DSGAI15", "DSGAI16", "DSGAI20"],
  "owasp_llm_top10_mapping": ["LLM01:2025", "LLM02:2025", "LLM01:2026", "LLM02:2026"],
  "severity": {
    "qualitative": "High"
  },
  "source_urls": [
    "https://www.legitsecurity.com/blog/remote-prompt-injection-in-gitlab-duo",
    "https://thehackernews.com/2025/05/gitlab-duo-vulnerability-enabled.html"
  ],
  "date_reported": "2025-02-12",
  "date_added": "2026-05-18",
  "disclosure_status": "coordinated_disclosure",
  "exploit_available": "public_poc",
  "mitigations": [
    "Strip Unicode tag characters, hidden whitespace, and zero-width characters from all repository content surfaced to the assistant.",
    "Disable HTML rendering of LLM output in the assistant's UI surface; render to plain text or sanitized markdown only.",
    "Block markdown image rendering to external hosts in any LLM-generated content shown in the developer UI.",
    "Treat any repository content — including comments — as untrusted instructions; isolate from system-prompt scope."
  ],
  "tags": ["prompt-injection", "indirect-prompt-injection", "code-assistant", "unicode-smuggling", "html-injection", "source-code-exfiltration"]
}
