{
  "$schema": "../schema.json",
  "vulnerability_id": "CVE-2024-37032",
  "title": "Ollama 'Probllama' path traversal to remote code execution",
  "description": "Ollama before 0.1.34 fails to validate the digest format (sha256 with 64 hex digits) when resolving the on-disk model path. A crafted manifest pushed to the model registry can include a digest that traverses outside the model store, allowing an attacker to write attacker-controlled bytes to arbitrary filesystem locations. Combined with overwriting libraries Ollama loads at startup, this yields remote code execution against the Ollama server.",
  "affected_component": "inference_server",
  "affected_products": ["Ollama < 0.1.34"],
  "dsgai_mapping": ["DSGAI04", "DSGAI17"],
  "owasp_llm_top10_mapping": ["LLM03:2025", "LLM05:2025", "LLM04:2026", "LLM10:2026"],
  "severity": {
    "qualitative": "High",
    "cvss_v3_score": 8.8,
    "cvss_v3_vector": "CVSS:3.1/AV:N/AC:L/PR:L/UI:N/S:U/C:H/I:H/A:H"
  },
  "cve_id": "CVE-2024-37032",
  "cwe_ids": ["CWE-22"],
  "source_urls": [
    "https://nvd.nist.gov/vuln/detail/CVE-2024-37032",
    "https://www.wiz.io/blog/probllama-ollama-vulnerability-cve-2024-37032",
    "https://github.com/ollama/ollama/pull/4175"
  ],
  "date_reported": "2024-05-31",
  "date_added": "2026-05-18",
  "disclosure_status": "public_cve",
  "exploit_available": "public_poc",
  "mitigations": [
    "Upgrade Ollama to 0.1.34 or later.",
    "Do not expose Ollama directly to the internet; place behind an authenticated reverse proxy.",
    "Run Ollama as a low-privilege user with a tightly scoped model store filesystem.",
    "Pin model sources to an internal mirror with manifest validation."
  ],
  "tags": ["path-traversal", "rce", "inference-server", "model-supply-chain"]
}
