{
  "$schema": "../schema.json",
  "vulnerability_id": "CVE-2024-13059",
  "title": "AnythingLLM multer non-ASCII filename path traversal to RCE",
  "description": "AnythingLLM before 1.3.1 mishandles non-ASCII filenames in the multer middleware, allowing manager- or admin-role attackers to embed directory-traversal sequences in uploaded filenames. The server then writes the uploaded content to arbitrary filesystem locations. Combined with overwriting an executed application file, this yields remote code execution on the AnythingLLM host.",
  "affected_component": "agent_framework",
  "affected_products": ["AnythingLLM < 1.3.1"],
  "dsgai_mapping": ["DSGAI06", "DSGAI02"],
  "owasp_llm_top10_mapping": ["LLM05:2025", "LLM10:2026"],
  "severity": {
    "qualitative": "High",
    "cvss_v3_score": 7.2,
    "cvss_v3_vector": "CVSS:3.0/AV:N/AC:L/PR:H/UI:N/S:U/C:H/I:H/A:H"
  },
  "cve_id": "CVE-2024-13059",
  "cwe_ids": ["CWE-22", "CWE-29"],
  "source_urls": [
    "https://nvd.nist.gov/vuln/detail/CVE-2024-13059",
    "https://huntr.com/bounties/92a875fe-c5b3-485c-b03f-d3185189e0b1",
    "https://www.offsec.com/blog/cve-2024-13059/"
  ],
  "date_reported": "2025-02-10",
  "date_added": "2026-05-18",
  "disclosure_status": "public_cve",
  "exploit_available": "public_poc",
  "mitigations": [
    "Upgrade AnythingLLM to 1.3.1 or later.",
    "Run AnythingLLM under a low-privilege user with a read-only application directory.",
    "Normalize and validate filenames at upload boundaries; reject non-ASCII traversal sequences."
  ],
  "tags": ["path-traversal", "rce", "file-upload", "non-ascii"]
}
