{
  "$schema": "../schema.json",
  "vulnerability_id": "CVE-2024-45848",
  "title": "MindsDB ChromaDB integration eval-injection RCE via INSERT",
  "description": "MindsDB 23.12.4.0 through 24.7.4.1, when configured with the ChromaDB integration, evaluates content of crafted INSERT queries through a Python eval call. An attacker authenticated to a MindsDB instance can submit a query containing Python code that runs server-side with the privileges of the MindsDB process, gaining access to all integrated data sources and vector store contents.",
  "affected_component": "agent_framework",
  "affected_products": ["MindsDB >= 23.12.4.0, < 24.7.4.1 (with ChromaDB integration)"],
  "dsgai_mapping": ["DSGAI12", "DSGAI13", "DSGAI06"],
  "owasp_llm_top10_mapping": ["LLM05:2025", "LLM06:2025", "LLM10:2026", "LLM03:2026"],
  "severity": {
    "qualitative": "High",
    "cvss_v3_score": 8.8,
    "cvss_v3_vector": "CVSS:3.1/AV:N/AC:L/PR:L/UI:N/S:U/C:H/I:H/A:H"
  },
  "cve_id": "CVE-2024-45848",
  "cwe_ids": ["CWE-94", "CWE-95"],
  "source_urls": [
    "https://nvd.nist.gov/vuln/detail/CVE-2024-45848",
    "https://hiddenlayer.com/sai-security-advisory/2024-09-mindsdb/"
  ],
  "date_reported": "2024-09-12",
  "date_added": "2026-05-18",
  "disclosure_status": "public_cve",
  "exploit_available": "public_poc",
  "mitigations": [
    "Upgrade MindsDB past 24.7.4.1.",
    "Disable the ChromaDB integration if not in use.",
    "Run MindsDB in an isolated network segment with minimal egress; assume any authenticated user can execute code on the host until patched."
  ],
  "tags": ["eval-injection", "rce", "vector-store-integration", "nl-to-db"]
}
