{
  "$schema": "../schema.json",
  "vulnerability_id": "CVE-2023-48022",
  "title": "Anyscale Ray 'ShadowRay' job submission API arbitrary code execution",
  "description": "Anyscale Ray 2.6.3 and 2.8.0 expose an unauthenticated job submission API that allows a remote attacker to submit and execute arbitrary code on the Ray head node. Although the vendor disputes the CVE on the grounds that Ray is designed for trusted, isolated networks, exposed Ray dashboards have been actively exploited in the wild (the 'ShadowRay' campaign) for cryptojacking and ML pipeline tampering.",
  "affected_component": "training_pipeline",
  "affected_products": ["Anyscale Ray 2.6.3", "Anyscale Ray 2.8.0", "Ray (any version with publicly exposed dashboard / job submission)"],
  "dsgai_mapping": ["DSGAI04", "DSGAI02"],
  "owasp_llm_top10_mapping": ["LLM03:2025", "LLM05:2025", "LLM04:2026", "LLM10:2026"],
  "severity": {
    "qualitative": "Critical",
    "cvss_v3_score": 9.8,
    "cvss_v3_vector": "CVSS:3.1/AV:N/AC:L/PR:N/UI:N/S:U/C:H/I:H/A:H"
  },
  "cve_id": "CVE-2023-48022",
  "cwe_ids": ["CWE-306", "CWE-918"],
  "source_urls": [
    "https://nvd.nist.gov/vuln/detail/CVE-2023-48022",
    "https://www.oligo.security/blog/shadowray",
    "https://docs.ray.io/en/latest/ray-security/index.html"
  ],
  "date_reported": "2023-11-28",
  "date_added": "2026-05-18",
  "disclosure_status": "public_cve",
  "exploit_available": "exploited_in_the_wild",
  "mitigations": [
    "Never expose the Ray dashboard or job submission API to untrusted networks; bind to loopback or place inside a private VPC.",
    "Front Ray with an authenticated reverse proxy and mTLS-enforced ingress.",
    "Run Ray clusters with workload isolation and restricted egress so a compromised worker cannot reach data sinks."
  ],
  "tags": ["rce", "missing-authentication", "training-pipeline", "exploited-in-the-wild", "shadowray"],
  "notes": "The vendor classifies this as a deployment misconfiguration rather than a code defect, but the exploited-in-the-wild status makes it a high-priority case for the DSGAI dataset given the data-plane access ShadowRay attackers obtained."
}
