{
  "$schema": "../schema.json",
  "vulnerability_id": "CVE-2024-7959",
  "title": "Open WebUI /openai/models SSRF allowing internal service access",
  "description": "Open WebUI 0.3.8 exposes an SSRF in the /openai/models endpoint. An authenticated user can override the upstream OpenAI base URL to point at an arbitrary host; the server then issues a request to that host and returns the response body. This enables reaching internal services, cloud metadata endpoints, and admin interfaces inside the Open WebUI deployment's network, often leaking secrets that lead to further compromise.",
  "affected_component": "agent_framework",
  "affected_products": ["Open WebUI 0.3.8"],
  "dsgai_mapping": ["DSGAI06", "DSGAI13", "DSGAI02"],
  "owasp_llm_top10_mapping": ["LLM05:2025", "LLM10:2026"],
  "severity": {
    "qualitative": "High",
    "cvss_v3_score": 7.7,
    "cvss_v3_vector": "CVSS:3.1/AV:N/AC:L/PR:L/UI:N/S:C/C:H/I:N/A:N"
  },
  "cve_id": "CVE-2024-7959",
  "cwe_ids": ["CWE-918"],
  "source_urls": [
    "https://nvd.nist.gov/vuln/detail/CVE-2024-7959",
    "https://github.com/advisories/GHSA-x757-hv69-jr45",
    "https://huntr.com/bounties/3c8bea0a-d678-4d67-bb9c-2b5b610a2193"
  ],
  "date_reported": "2025-03-20",
  "date_added": "2026-05-18",
  "disclosure_status": "public_cve",
  "exploit_available": "public_poc",
  "mitigations": [
    "Upgrade Open WebUI past 0.3.8.",
    "Restrict the LLM provider base URL setting to administrators only; do not expose to general users.",
    "Block cloud metadata addresses and RFC1918 ranges at the egress proxy used by Open WebUI."
  ],
  "tags": ["ssrf", "ai-gateway", "credential-exposure"]
}
