{
  "$schema": "../schema.json",
  "vulnerability_id": "CVE-2023-46229",
  "title": "LangChain RecursiveUrlLoader SSRF via uncontrolled crawl",
  "description": "LangChain before 0.0.317 contains a server-side request forgery vulnerability in document_loaders/recursive_url_loader.py. The recursive crawler follows links from an external starting URL into internal infrastructure, enabling an attacker who controls or influences a seed document to drive the loader against internal hosts (cloud metadata endpoints, internal APIs, vector store admin interfaces).",
  "affected_component": "rag_pipeline",
  "affected_products": ["LangChain < 0.0.317"],
  "dsgai_mapping": ["DSGAI06", "DSGAI13"],
  "owasp_llm_top10_mapping": ["LLM05:2025", "LLM06:2025", "LLM10:2026", "LLM03:2026"],
  "severity": {
    "qualitative": "High",
    "cvss_v3_score": 8.8,
    "cvss_v3_vector": "CVSS:3.1/AV:N/AC:L/PR:N/UI:R/S:U/C:H/I:H/A:H"
  },
  "cve_id": "CVE-2023-46229",
  "cwe_ids": ["CWE-918"],
  "source_urls": [
    "https://nvd.nist.gov/vuln/detail/CVE-2023-46229",
    "https://github.com/langchain-ai/langchain/pull/11925",
    "https://github.com/langchain-ai/langchain/commit/9ecb7240a480720ec9d739b3877a52f76098a2b8"
  ],
  "date_reported": "2023-10-19",
  "date_added": "2026-05-18",
  "disclosure_status": "public_cve",
  "exploit_available": "public_poc",
  "mitigations": [
    "Upgrade to LangChain 0.0.317 or later.",
    "Restrict the loader's network egress to an allowlist of expected domains.",
    "Block cloud metadata addresses (169.254.169.254, link-local, RFC1918 ranges) at the egress proxy used by ingestion."
  ],
  "tags": ["ssrf", "rag-ingestion", "crawler"]
}
