{
  "$schema": "../schema.json",
  "vulnerability_id": "DSGAI-VULN-2023-multimodal-image-prompt-injection",
  "title": "Multimodal image prompt injection against GPT-4V (and equivalent VLMs)",
  "description": "Shortly after GPT-4V's September 2023 launch, researchers demonstrated that adversarial instructions rendered as visible text inside an image — including low-contrast, small-font, rotated, or background-blended text — are read and obeyed by the model. This bypasses any text-only input filtering because the directive enters the model as image tokens, not as text. The class includes 'invisible' instructions readable by OCR but not the user, and applies broadly to any vision-language model deployed as an assistant.",
  "affected_component": "model",
  "affected_products": ["OpenAI GPT-4V and successors", "any vision-language assistant that accepts user-supplied images"],
  "dsgai_mapping": ["DSGAI09", "DSGAI01", "DSGAI21"],
  "owasp_llm_top10_mapping": ["LLM01:2025", "LLM01:2026"],
  "severity": {
    "qualitative": "High"
  },
  "source_urls": [
    "https://simonwillison.net/2023/Oct/14/multi-modal-prompt-injection/",
    "https://www.lakera.ai/blog/visual-prompt-injections",
    "https://venturebeat.com/security/why-gpt-4-is-vulnerable-to-multimodal-prompt-injection-image-attacks"
  ],
  "date_reported": "2023-10-14",
  "date_added": "2026-05-18",
  "disclosure_status": "research_publication",
  "exploit_available": "public_poc",
  "mitigations": [
    "Run OCR on user-supplied images and feed the extracted text through the same injection-detection filters used on text input.",
    "Detect and flag images containing imperative text (e.g. 'ignore previous instructions', URL strings, base64) before passing to the VLM.",
    "Limit the assistant's tool surface and egress channels so a hijacked turn cannot exfiltrate data.",
    "Apply the same DSGAI09 (Multimodal Capture & Cross-Channel Data Leakage) controls used for OCR-rendered content paths."
  ],
  "tags": ["prompt-injection", "multimodal", "vision-language-model", "ocr-bypass", "visual-injection"]
}
