{
  "$schema": "../schema.json",
  "vulnerability_id": "DSGAI-VULN-2024-chromadb-default-embedding-egress",
  "title": "ChromaDB DefaultEmbeddingFunction silently sends documents to external service",
  "description": "ChromaDB's DefaultEmbeddingFunction, used when a developer does not pass an explicit embedding_function to collection.add()/query(), routes the full document content to a third-party embedding service (historically the upstream all-MiniLM-L6-v2 download path; in some MindsDB- and integration-shipped configurations to the OpenAI API). For deployments that index sensitive corpora, this constitutes silent cross-boundary data egress — a Shadow AI data-flow failure that occurs even when no explicit LLM call is made. The behavior was reported as an issue on November 11, 2024.",
  "affected_component": "vector_store",
  "affected_products": ["ChromaDB (versions where DefaultEmbeddingFunction silently calls out without explicit user opt-in)"],
  "dsgai_mapping": ["DSGAI03", "DSGAI14", "DSGAI01", "DSGAI13"],
  "owasp_llm_top10_mapping": ["LLM06:2025", "LLM07:2025", "LLM03:2026", "LLM08:2026"],
  "severity": {
    "qualitative": "High"
  },
  "source_urls": [
    "https://github.com/chroma-core/chroma/issues/5848",
    "https://www.upguard.com/blog/open-chroma-databases-ai-attack-surface"
  ],
  "date_reported": "2024-11-11",
  "date_added": "2026-05-18",
  "disclosure_status": "research_publication",
  "exploit_available": "none_known",
  "mitigations": [
    "Always pass an explicit embedding_function to ChromaDB collections; never rely on DefaultEmbeddingFunction in production.",
    "Block the embedding-service domains at the network layer for any environment where indexed content is sensitive.",
    "Inventory all RAG ingestion paths and document which embedding model each one uses, where it runs, and what data it sees (DSGAI07 lineage).",
    "Audit ChromaDB instances for missing authentication; the 2025 UpGuard scan found 1,170 internet-exposed Chroma databases."
  ],
  "tags": ["shadow-data-flow", "third-party-egress", "embedding-leakage", "vector-store", "default-misconfiguration"]
}
