{
  "$schema": "../schema.json",
  "vulnerability_id": "DSGAI-VULN-2023-bing-chat-indirect-prompt-injection",
  "title": "Indirect prompt injection against Bing Chat (Greshake et al., 2023)",
  "description": "Greshake et al. (arXiv 2302.12173, AISec '23) demonstrated indirect prompt injection against Microsoft's GPT-4-powered Bing Chat, GPT-4 code completion, and synthetic agents. By embedding hidden instructions on a webpage that Bing Chat retrieved while assisting a user, the researchers caused the assistant to adopt the attacker's persona (a discounted Surface Laptop salesman) and elicit the victim's email address and financial details. The work introduced the indirect prompt injection threat taxonomy — data theft, worming, ecosystem contamination, and unauthorized API calls — and is the foundational reference for the class.",
  "affected_component": "agent_framework",
  "affected_products": ["Microsoft Bing Chat (GPT-4-powered, early 2023)", "any retrieval-augmented LLM that ingests third-party web content"],
  "dsgai_mapping": ["DSGAI01", "DSGAI15", "DSGAI21"],
  "owasp_llm_top10_mapping": ["LLM01:2025", "LLM01:2026"],
  "severity": {
    "qualitative": "High"
  },
  "source_urls": [
    "https://arxiv.org/abs/2302.12173",
    "https://greshake.github.io/",
    "https://kai-greshake.de/posts/llm-malware/"
  ],
  "date_reported": "2023-02-23",
  "date_added": "2026-05-18",
  "disclosure_status": "research_publication",
  "exploit_available": "public_poc",
  "mitigations": [
    "Treat retrieved content as untrusted instructions; isolate it from system-prompt scope with strict delimiters and instruction-hierarchy enforcement.",
    "Apply input filters on retrieved content for instruction-like phrasing and known injection patterns.",
    "Constrain the assistant's tool surface and egress so a hijacked turn cannot reach attacker infrastructure.",
    "Treat any RAG corpus as part of the trust boundary; require provenance and integrity controls on indexed content."
  ],
  "tags": ["prompt-injection", "indirect-prompt-injection", "foundational-research", "rag-poisoning"]
}
