{
  "$schema": "../schema.json",
  "vulnerability_id": "CVE-2024-34359",
  "title": "llama-cpp-python Jinja2 server-side template injection RCE via model metadata",
  "description": "llama-cpp-python 0.2.30 through 0.2.71 extracts the chat_template field from .gguf model file metadata and renders it through jinja2.Environment without sandboxing. A crafted .gguf model file containing a malicious template causes arbitrary Python code to execute on the host the moment the model is loaded and the chat handler is invoked. At time of disclosure, approximately 6,000 Hugging Face models packaged with llama-cpp-python were affected. Disclosed by Checkmarx as 'Llama Drama'.",
  "affected_component": "model",
  "affected_products": ["llama-cpp-python >= 0.2.30, <= 0.2.71"],
  "dsgai_mapping": ["DSGAI04", "DSGAI20"],
  "owasp_llm_top10_mapping": ["LLM03:2025", "LLM04:2026"],
  "severity": {
    "qualitative": "Critical",
    "cvss_v3_score": 9.6,
    "cvss_v3_vector": "CVSS:3.1/AV:N/AC:L/PR:N/UI:R/S:C/C:H/I:H/A:H"
  },
  "cve_id": "CVE-2024-34359",
  "cwe_ids": ["CWE-1336", "CWE-94"],
  "source_urls": [
    "https://github.com/abetlen/llama-cpp-python/security/advisories/GHSA-56xg-wfcc-g829",
    "https://checkmarx.com/blog/llama-drama-critical-vulnerability-cve-2024-34359-threatening-your-software-supply-chain/"
  ],
  "date_reported": "2024-05-13",
  "date_added": "2026-05-18",
  "disclosure_status": "public_cve",
  "exploit_available": "public_poc",
  "mitigations": [
    "Upgrade llama-cpp-python to 0.2.72 or later (sandboxed Jinja2 environment).",
    "Verify .gguf model files against a curated internal mirror; reject metadata fields that contain Jinja control syntax from untrusted sources.",
    "Run inference workers in an isolated container without secrets or sensitive filesystem access."
  ],
  "tags": ["rce", "ssti", "jinja2", "model-supply-chain", "gguf"]
}
